{
  "schema_version": 1,
  "provenance": {
    "audit_date": "2026-08-04",
    "audit_rows": 470,
    "audit_sha256": "f3cc273898e7604a7d3b947be95bbf24dc6fa1df082aa55cf777c0c83d6a3fd2",
    "support_matrix_sha256": "c17c3091b3c0ced929383b7d4c5507a09ed5dee3fde690496aa85da39a25cb9a",
    "selection": "as recorded at the 2026-08-04 admission audit: the verified repositories docs/support-matrix.md enumerated then, plus the canonical repository of each family whose upstream source file is not tokenizer.json, plus repositories published after that snapshot whose upstream file was compared byte for byte against the shipped anchor on the date recorded beside them in docs/support-matrix.md. This whole block is a snapshot of that audit and is deliberately not refreshed against the current tree: audit_date, audit_rows and audit_sha256 are what was observed then, and support_matrix_sha256 is the digest docs/support-matrix.md carried at the admission commit, not the digest it carries today. Nothing checks it, because there is nothing for it to agree with; rewriting it to the current digest would make the record describe an audit that did not happen. Rows whose basis is equivalent_loader_face were admitted since 0.2.9: their audited tokenizer file group materializes, under the pinned loader, a loader face byte-identical to the certified family anchor face, re-established by the maintainer materialization check on the date recorded beside them in docs/support-matrix.md."
  },
  "counts": {
    "identical": 152,
    "identical_source": 13,
    "equivalent_canonicalisation": 10,
    "equivalent_serialisation": 38,
    "equivalent_loader_face": 2,
    "total": 215
  },
  "aliases": [
    {
      "repo_id": "allenai/Olmo-3-1125-32B",
      "revision": "c2b61dae89a1ad10e4ad5653d0e46b590902607b",
      "source_file": "tokenizer.json",
      "source_sha256": "73fd5254624f39a88e3faac6a8e11300fc3c735ed37880d4f4f08db898eaecca",
      "source_size": 7137177,
      "canonical_family": "olmo_3_7b",
      "canonical_anchor_sha256": "73fd5254624f39a88e3faac6a8e11300fc3c735ed37880d4f4f08db898eaecca",
      "basis": "identical"
    },
    {
      "repo_id": "allenai/Olmo-3-32B-Think",
      "revision": "f2edda15216e738ef2bb73771e11890e152b2112",
      "source_file": "tokenizer.json",
      "source_sha256": "73fd5254624f39a88e3faac6a8e11300fc3c735ed37880d4f4f08db898eaecca",
      "source_size": 7137177,
      "canonical_family": "olmo_3_7b",
      "canonical_anchor_sha256": "73fd5254624f39a88e3faac6a8e11300fc3c735ed37880d4f4f08db898eaecca",
      "basis": "identical"
    },
    {
      "repo_id": "allenai/Olmo-3-32B-Think-DPO",
      "revision": "97604023f2602a7dfe6d31b1fc229985e0002022",
      "source_file": "tokenizer.json",
      "source_sha256": "73fd5254624f39a88e3faac6a8e11300fc3c735ed37880d4f4f08db898eaecca",
      "source_size": 7137177,
      "canonical_family": "olmo_3_7b",
      "canonical_anchor_sha256": "73fd5254624f39a88e3faac6a8e11300fc3c735ed37880d4f4f08db898eaecca",
      "basis": "identical"
    },
    {
      "repo_id": "allenai/Olmo-3-32B-Think-SFT",
      "revision": "a6d7f3cf497c7049712c13a664c65c7992f2da0c",
      "source_file": "tokenizer.json",
      "source_sha256": "ae12cb7a47a48bba7131225fb776a7c1c138747986affea7902b5d9966a49891",
      "source_size": 4822289,
      "canonical_family": "olmo_3_7b",
      "canonical_anchor_sha256": "73fd5254624f39a88e3faac6a8e11300fc3c735ed37880d4f4f08db898eaecca",
      "basis": "equivalent_serialisation"
    },
    {
      "repo_id": "allenai/Olmo-3-7B-Think",
      "revision": "d97e442d7cc678210054dbcc9b440894d62c89a4",
      "source_file": "tokenizer.json",
      "source_sha256": "73fd5254624f39a88e3faac6a8e11300fc3c735ed37880d4f4f08db898eaecca",
      "source_size": 7137177,
      "canonical_family": "olmo_3_7b",
      "canonical_anchor_sha256": "73fd5254624f39a88e3faac6a8e11300fc3c735ed37880d4f4f08db898eaecca",
      "basis": "identical"
    },
    {
      "repo_id": "allenai/Olmo-3-7B-Think-DPO",
      "revision": "7b18bf927b430ff06376fdfa5610eb3b1b6a5c38",
      "source_file": "tokenizer.json",
      "source_sha256": "73fd5254624f39a88e3faac6a8e11300fc3c735ed37880d4f4f08db898eaecca",
      "source_size": 7137177,
      "canonical_family": "olmo_3_7b",
      "canonical_anchor_sha256": "73fd5254624f39a88e3faac6a8e11300fc3c735ed37880d4f4f08db898eaecca",
      "basis": "identical"
    },
    {
      "repo_id": "allenai/Olmo-3-7B-Think-SFT",
      "revision": "6ff857587e040d6d523a3d5f3a56e918f5401d66",
      "source_file": "tokenizer.json",
      "source_sha256": "ae12cb7a47a48bba7131225fb776a7c1c138747986affea7902b5d9966a49891",
      "source_size": 4822289,
      "canonical_family": "olmo_3_7b",
      "canonical_anchor_sha256": "73fd5254624f39a88e3faac6a8e11300fc3c735ed37880d4f4f08db898eaecca",
      "basis": "equivalent_serialisation"
    },
    {
      "repo_id": "allenai/Olmo-3.1-32B-Think",
      "revision": "832c3f543499af8fe68b88359501de9cb7840544",
      "source_file": "tokenizer.json",
      "source_sha256": "73fd5254624f39a88e3faac6a8e11300fc3c735ed37880d4f4f08db898eaecca",
      "source_size": 7137177,
      "canonical_family": "olmo_3_7b",
      "canonical_anchor_sha256": "73fd5254624f39a88e3faac6a8e11300fc3c735ed37880d4f4f08db898eaecca",
      "basis": "identical"
    },
    {
      "repo_id": "allenai/Olmo-3.1-7B-RL-Zero-Math",
      "revision": "364820b002fc8e81d11a81c7fc9dd6b49c83cd05",
      "source_file": "tokenizer.json",
      "source_sha256": "73fd5254624f39a88e3faac6a8e11300fc3c735ed37880d4f4f08db898eaecca",
      "source_size": 7137177,
      "canonical_family": "olmo_3_7b",
      "canonical_anchor_sha256": "73fd5254624f39a88e3faac6a8e11300fc3c735ed37880d4f4f08db898eaecca",
      "basis": "identical"
    },
    {
      "repo_id": "deepseek-ai/DeepSeek-V3-0324",
      "revision": "e9b33add76883f293d6bf61f6bd89b497e80e335",
      "source_file": "tokenizer.json",
      "source_sha256": "621ac2e32d0dba658404412318818aaa8ce8cda492e59830109d8da6b517fb41",
      "source_size": 7847652,
      "canonical_family": "deepseek_v3",
      "canonical_anchor_sha256": "621ac2e32d0dba658404412318818aaa8ce8cda492e59830109d8da6b517fb41",
      "basis": "identical"
    },
    {
      "repo_id": "deepseek-ai/DeepSeek-V3-Base",
      "revision": "afb92e1fa402c2be2a9eb085312bb02e0384d6c7",
      "source_file": "tokenizer.json",
      "source_sha256": "621ac2e32d0dba658404412318818aaa8ce8cda492e59830109d8da6b517fb41",
      "source_size": 7847652,
      "canonical_family": "deepseek_v3",
      "canonical_anchor_sha256": "621ac2e32d0dba658404412318818aaa8ce8cda492e59830109d8da6b517fb41",
      "basis": "identical"
    },
    {
      "repo_id": "deepseek-ai/DeepSeek-V4-Flash-0731",
      "revision": "7872f01b1d1fe23eabc4c98b48bffcef5a386062",
      "source_file": "tokenizer.json",
      "source_sha256": "8f9f37ca37fdc4f5fd36d5cf4d3b0e8392edb4e894fd10cc0d70b4957c8633cf",
      "source_size": 6367146,
      "canonical_family": "deepseek_v4_flash",
      "canonical_anchor_sha256": "8f9f37ca37fdc4f5fd36d5cf4d3b0e8392edb4e894fd10cc0d70b4957c8633cf",
      "basis": "identical"
    },
    {
      "repo_id": "deepseek-ai/DeepSeek-V4-Flash-Base",
      "revision": "8855555deef230a27a21a8d6f294b7b7497759b6",
      "source_file": "tokenizer.json",
      "source_sha256": "8f9f37ca37fdc4f5fd36d5cf4d3b0e8392edb4e894fd10cc0d70b4957c8633cf",
      "source_size": 6367146,
      "canonical_family": "deepseek_v4_flash",
      "canonical_anchor_sha256": "8f9f37ca37fdc4f5fd36d5cf4d3b0e8392edb4e894fd10cc0d70b4957c8633cf",
      "basis": "identical"
    },
    {
      "repo_id": "deepseek-ai/DeepSeek-V4-Flash-DSpark",
      "revision": "62af8fffb2f7030cac4de2f0169f5b8d1101b646",
      "source_file": "tokenizer.json",
      "source_sha256": "8f9f37ca37fdc4f5fd36d5cf4d3b0e8392edb4e894fd10cc0d70b4957c8633cf",
      "source_size": 6367146,
      "canonical_family": "deepseek_v4_flash",
      "canonical_anchor_sha256": "8f9f37ca37fdc4f5fd36d5cf4d3b0e8392edb4e894fd10cc0d70b4957c8633cf",
      "basis": "identical"
    },
    {
      "repo_id": "deepseek-ai/DeepSeek-V4-Pro",
      "revision": "b5968e9190ef611bbf34a7229255be88a0e937c1",
      "source_file": "tokenizer.json",
      "source_sha256": "8f9f37ca37fdc4f5fd36d5cf4d3b0e8392edb4e894fd10cc0d70b4957c8633cf",
      "source_size": 6367146,
      "canonical_family": "deepseek_v4_flash",
      "canonical_anchor_sha256": "8f9f37ca37fdc4f5fd36d5cf4d3b0e8392edb4e894fd10cc0d70b4957c8633cf",
      "basis": "identical"
    },
    {
      "repo_id": "deepseek-ai/DeepSeek-V4-Pro-0813",
      "revision": "72e1d3230f6c080a530b0a1d46f8eb4602340597",
      "source_file": "tokenizer.json",
      "source_sha256": "8f9f37ca37fdc4f5fd36d5cf4d3b0e8392edb4e894fd10cc0d70b4957c8633cf",
      "source_size": 6367146,
      "canonical_family": "deepseek_v4_flash",
      "canonical_anchor_sha256": "8f9f37ca37fdc4f5fd36d5cf4d3b0e8392edb4e894fd10cc0d70b4957c8633cf",
      "basis": "identical"
    },
    {
      "repo_id": "deepseek-ai/DeepSeek-V4-Pro-Base",
      "revision": "98730c030fbdbaca4950788280a35c4642b208a9",
      "source_file": "tokenizer.json",
      "source_sha256": "8f9f37ca37fdc4f5fd36d5cf4d3b0e8392edb4e894fd10cc0d70b4957c8633cf",
      "source_size": 6367146,
      "canonical_family": "deepseek_v4_flash",
      "canonical_anchor_sha256": "8f9f37ca37fdc4f5fd36d5cf4d3b0e8392edb4e894fd10cc0d70b4957c8633cf",
      "basis": "identical"
    },
    {
      "repo_id": "deepseek-ai/DeepSeek-V4-Pro-DSpark",
      "revision": "7c09739fd136abfb70a49ec334157f65f45b52cd",
      "source_file": "tokenizer.json",
      "source_sha256": "8f9f37ca37fdc4f5fd36d5cf4d3b0e8392edb4e894fd10cc0d70b4957c8633cf",
      "source_size": 6367146,
      "canonical_family": "deepseek_v4_flash",
      "canonical_anchor_sha256": "8f9f37ca37fdc4f5fd36d5cf4d3b0e8392edb4e894fd10cc0d70b4957c8633cf",
      "basis": "identical"
    },
    {
      "repo_id": "google-bert/bert-base-cased-finetuned-mrpc",